{
  "name": "Shamrock",
  "rarity": "Legendary",
  "element": "Spirit",
  "type": "Assist",
  "rating": {
    "overall": "A",
    "campaign": "C",
    "arena_offense": "S",
    "arena_defense": "S",
    "clan_boss_without_giant_slayer": "B",
    "clan_boss_with_giant_slayer": "B",
    "ice_guardian": "A",
    "dragon": "A",
    "spider": "C",
    "fire_knight": "C",
    "minotaur": "A",
    "force_dungeon": "B",
    "magic_dungeon": "A",
    "spirit_dungeon": "C",
    "void_dungeon": "B"
  },
  "slug": "shamrock",
  "characteristics": {
    "60": {
      "hp": 20805,
      "attack": 1002,
      "defense": 1189,
      "speed": 111,
      "critical_rate": 0.15,
      "critical_damage": 0.5,
      "resistance": 40,
      "accuracy": 0
    }
  },
  "auras": [
    {
      "raw_description": "Increases Ally ACC in all Battles by 70."
    }
  ],
  "skills": [
    {
      "name": "Luck Swap",
      "raw_description": "Attacks 1 enemy 2 times. Has a 60% chance of removing 1 random buff from the target.<br>Damage based on: [ATK]<br>Lvl. 2 Damage +5%<br>Lvl. 3 Damage +5%<br>Lvl. 4 Buff/Debuff Chance +5%<br>Lvl. 5 Buff/Debuff Chance +10%",
      "slug": "luck-swap"
    },
    {
      "name": "Lucky Charms",
      "raw_description": "Places a 60% [Increase DEF] buff on all allies for 2 turns. Has a 50% chance of placing a 30% [Increase C. RATE] buff on all allies for 2 turns. Also has a 25% chance of placing a 15% [Continuous Heal] buff on all allies for 2 turns if the [increase C. RATE] buff is placed. Has a 5% chance of placing a [Block Debuffs] buff on all allies for 2 turns if the [Continuous Heal] buff is placed.<br>Lvl. 2 Buff/Debuff Chance +5%<br>Lvl. 3 Buff/Debuff Chance +5%<br>Lvl. 4 Buff/Debuff Chance +5%<br>Lvl. 5 Buff/Debuff Chance +5%<br>Lvl. 6 Cooldown -1",
      "slug": "lucky-charms"
    },
    {
      "name": "Uncatchable",
      "raw_description": "Places a 30% [Decrease SPD] debuff on all enemies for 2 turns. Decreases the Turn Meter of all enemies by 15%. Has a 10% chance of decreasing the Turn Meter of all enemies by a further 15%.<br>Lvl. 2 Cooldown -1",
      "slug": "uncatchable"
    }
  ],
  "faction": {
    "name": "Ogryn-Tribes",
    "slug": "ogryn-tribes",
    "website_link": "/factions/ogryn-tribes/",
    "image_slug": "image-faction-ogryn-tribes",
    "number_of_champions": 0,
    "default_description": "Ogryn-Tribes is a faction from RAID Shadow Legends",
    "seo": {
      "title": "%%title%% %%page%% %%sep%% %%parent_title%% %%sep%% %%sitename%%",
      "description": "Ogryn-Tribes is a faction from RAID Shadow Legends. Find out more on this Raid Shadow Legends codex.",
      "keywords": [
        "raid",
        "shadow",
        "legends",
        "factions",
        "Ogryn-Tribes",
        "ogryn-tribes"
      ]
    }
  },
  "faction_slug": "ogryn-tribes",
  "website_link": "/champions/shamrock/",
  "image_slug": "image-champion-shamrock",
  "seo": {
    "title": "%%title%% %%page%% %%sep%% %%parent_title%% %%sep%% %%sitename%%",
    "description": "Shamrock is a legendary assist champion from the faction Ogryn-Tribes doing spirit damage. Find out more on this Raid Shadow Legends codex.",
    "keywords": [
      "raid",
      "shadow",
      "legends",
      "champions",
      "tier",
      "list",
      "Shamrock",
      "shamrock"
    ]
  },
  "default_description": "Shamrock is a legendary assist champion from the faction Ogryn-Tribes doing spirit damage",
  "recommended_builds": [],
  "lore": ""
}