{
  "name": "Jaeger",
  "rarity": "Uncommon",
  "element": "",
  "type": "Attack",
  "rating": {
    "overall": "D",
    "campaign": "",
    "arena_offense": "",
    "arena_defense": "",
    "clan_boss_without_giant_slayer": "",
    "clan_boss_with_giant_slayer": "",
    "ice_guardian": "",
    "dragon": "",
    "spider": "",
    "fire_knight": "",
    "minotaur": "",
    "force_dungeon": "",
    "magic_dungeon": "",
    "spirit_dungeon": "",
    "void_dungeon": ""
  },
  "slug": "jaeger",
  "characteristics": {
    "60": {
      "hp": 14370,
      "attack": 1200,
      "defense": 595,
      "speed": 100,
      "critical_rate": 0.15,
      "critical_damage": 0.5,
      "resistance": 30,
      "accuracy": 0
    }
  },
  "auras": [],
  "skills": [
    {
      "name": "Shackle Shot",
      "raw_description": "Attacks 1 enemy. Has a 10% chance of placing a 15% [Decrease SPD] debuff for 1 turn.<br>Damage based on: [ATK]<br>Lvl. 2 Damage +5%<br>Lvl. 3 Damage +5%<br>Lvl. 4 Buff/Debuff Chance +5%<br>Lvl. 5 Buff/Debuff Chance +10%",
      "slug": "shackle-shot"
    },
    {
      "name": "Freezing Arrow",
      "raw_description": "Attacks 1 enemy. Has a 30% chance of placing a [Freeze] debuff for 1 turn.<br>Damage based on: [ATK]<br>Lvl. 2 Damage +5%<br>Lvl. 3 Damage +5%<br>Lvl. 4 Damage +10%<br>Lvl. 5 Buff/Debuff Chance +10%<br>Lvl. 6 Buff/Debuff Chance +20%<br>Lvl. 7 Cooldown -1",
      "slug": "freezing-arrow"
    }
  ],
  "faction": {
    "name": "High Elves",
    "slug": "high-elves",
    "website_link": "/factions/high-elves/",
    "image_slug": "image-faction-high-elves",
    "number_of_champions": 0,
    "default_description": "High Elves is a faction from RAID Shadow Legends",
    "seo": {
      "title": "%%title%% %%page%% %%sep%% %%parent_title%% %%sep%% %%sitename%%",
      "description": "High Elves is a faction from RAID Shadow Legends. Find out more on this Raid Shadow Legends codex.",
      "keywords": [
        "raid",
        "shadow",
        "legends",
        "factions",
        "High Elves",
        "high-elves"
      ]
    }
  },
  "faction_slug": "high-elves",
  "website_link": "/champions/jaeger/",
  "image_slug": "image-champion-jaeger",
  "seo": {
    "title": "%%title%% %%page%% %%sep%% %%parent_title%% %%sep%% %%sitename%%",
    "description": "Jaeger is a uncommon attack champion from the faction High Elves. Find out more on this Raid Shadow Legends codex.",
    "keywords": [
      "raid",
      "shadow",
      "legends",
      "champions",
      "tier",
      "list",
      "Jaeger",
      "jaeger"
    ]
  },
  "default_description": "Jaeger is a uncommon attack champion from the faction High Elves",
  "recommended_builds": [],
  "lore": ""
}
