{
  "name": "Duelist",
  "rarity": "Uncommon",
  "element": "",
  "type": "Attack",
  "rating": {
    "overall": "D",
    "campaign": "",
    "arena_offense": "",
    "arena_defense": "",
    "clan_boss_without_giant_slayer": "",
    "clan_boss_with_giant_slayer": "",
    "ice_guardian": "",
    "dragon": "",
    "spider": "",
    "fire_knight": "",
    "minotaur": "",
    "force_dungeon": "",
    "magic_dungeon": "",
    "spirit_dungeon": "",
    "void_dungeon": ""
  },
  "slug": "duelist",
  "characteristics": {
    "60": {
      "hp": 11400,
      "attack": 1200,
      "defense": 793,
      "speed": 101,
      "critical_rate": 0.15,
      "critical_damage": 0.5,
      "resistance": 30,
      "accuracy": 0
    }
  },
  "auras": [],
  "skills": [
    {
      "name": "Elan",
      "raw_description": "Attacks 1 enemy. Heals by 20% of the damage inflicted.<br>Damage based on: [ATK]<br>Lvl. 2 Damage +5%<br>Lvl. 3 Damage +5%<br>Lvl. 4 Heal +10%<br>Lvl. 5 Damage +10%<br>Lvl. 6 Damage +15%<br>Lvl. 7 Heal +15%",
      "slug": "elan"
    },
    {
      "name": "Stunning Slice",
      "raw_description": "Attacks 1 enemy. Has a 50% chance of placing a [Stun] debuff for 1 turn.<br>Damage based on: [ATK]<br>Lvl. 2 Damage +5%<br>Lvl. 3 Damage +5%<br>Lvl. 4 Buff/Debuff Chance +10%<br>Lvl. 5 Damage +10%<br>Lvl. 6 Buff/Debuff Chance +15%<br>Lvl. 7 Damage +10%<br>Lvl. 8 Cooldown -1",
      "slug": "stunning-slice"
    }
  ],
  "faction": {
    "name": "Banner-Lords",
    "slug": "banner-lords",
    "website_link": "/factions/banner-lords/",
    "image_slug": "image-faction-banner-lords",
    "number_of_champions": 0,
    "default_description": "Banner Lords is a faction from RAID Shadow Legends",
    "seo": {
      "title": "%%title%% %%page%% %%sep%% %%parent_title%% %%sep%% %%sitename%%",
      "description": "Banner Lords is a faction from RAID Shadow Legends. Find out more on this Raid Shadow Legends codex.",
      "keywords": [
        "raid",
        "shadow",
        "legends",
        "factions",
        "Banner Lords",
        "banner-lords"
      ]
    }
  },
  "faction_slug": "banner-lords",
  "website_link": "/champions/duelist/",
  "image_slug": "image-champion-duelist",
  "seo": {
    "title": "%%title%% %%page%% %%sep%% %%parent_title%% %%sep%% %%sitename%%",
    "description": "Duelist is a uncommon attack champion from the faction Banner Lords. Find out more on this Raid Shadow Legends codex.",
    "keywords": [
      "raid",
      "shadow",
      "legends",
      "champions",
      "tier",
      "list",
      "Duelist",
      "duelist"
    ]
  },
  "default_description": "Duelist is a uncommon attack champion from the faction Banner Lords",
  "recommended_builds": [],
  "lore": ""
}