{
  "name": "Luthiea",
  "rarity": "Epic",
  "element": "Force",
  "type": "Attack",
  "rating": {
    "overall": "A",
    "campaign": "B",
    "arena_offense": "A",
    "arena_defense": "B",
    "clan_boss_without_giant_slayer": "A",
    "clan_boss_with_giant_slayer": "A",
    "ice_guardian": "A",
    "dragon": "A",
    "spider": "A",
    "fire_knight": "B",
    "minotaur": "A",
    "force_dungeon": "B",
    "magic_dungeon": "B",
    "spirit_dungeon": "B",
    "void_dungeon": "A"
  },
  "slug": "luthiea",
  "characteristics": {
    "60": {
      "hp": 14370,
      "attack": 1277,
      "defense": 1068,
      "speed": 93,
      "critical_rate": 0.15,
      "critical_damage": 0.5,
      "resistance": 30,
      "accuracy": 20
    }
  },
  "auras": [],
  "skills": [
    {
      "name": "Burning Arrow",
      "raw_description": "Attacks 1 enemy. Has a 30% chance of placing a 5% [Poison] debuff for 2 turns.<br>Damage based on: [ATK]<br>Lvl. 2 Damage +5%<br>Lvl. 3 Damage +5%<br>Lvl. 4 Buff/Debuff Chance +5%<br>Lvl. 5 Buff/Debuff Chance +5%<br>Lvl. 6 Buff/Debuff Chance +10%",
      "slug": "burning-arrow"
    },
    {
      "name": "Ice Shot",
      "raw_description": "Attacks 3 times at random. Each hit has a 25% chance of placing a [Freeze] debuff for 1 turn.<br>Damage based on: [ATK]<br>Lvl. 2 Damage +5%<br>Lvl. 3 Damage +10%<br>Lvl. 4 Damage +10%<br>Lvl. 5 Cooldown -1",
      "slug": "ice-shot"
    },
    {
      "name": "Numbing Poison",
      "raw_description": "Attacks all enemies. Has a 75% chance of placing a 30% [Decrease SPD] debuff for 2 turns.<br>Damage based on: [ATK]<br>Lvl. 2 Damage +5%<br>Lvl. 3 Damage +10%<br>Lvl. 4 Buff/Debuff Chance +10%<br>Lvl. 5 Buff/Debuff Chance +15%<br>Lvl. 6 Cooldown -1",
      "slug": "numbing-poison"
    }
  ],
  "faction": {
    "name": "High Elves",
    "slug": "high-elves",
    "website_link": "/factions/high-elves/",
    "image_slug": "image-faction-high-elves",
    "number_of_champions": 0,
    "default_description": "High Elves is a faction from RAID Shadow Legends",
    "seo": {
      "title": "%%title%% %%page%% %%sep%% %%parent_title%% %%sep%% %%sitename%%",
      "description": "High Elves is a faction from RAID Shadow Legends. Find out more on this Raid Shadow Legends codex.",
      "keywords": [
        "raid",
        "shadow",
        "legends",
        "factions",
        "High Elves",
        "high-elves"
      ]
    }
  },
  "faction_slug": "high-elves",
  "website_link": "/champions/luthiea/",
  "image_slug": "image-champion-luthiea",
  "seo": {
    "title": "%%title%% %%page%% %%sep%% %%parent_title%% %%sep%% %%sitename%%",
    "description": "Luthiea is a epic attack champion from the faction High Elves doing force damage. Find out more on this Raid Shadow Legends codex.",
    "keywords": [
      "raid",
      "shadow",
      "legends",
      "champions",
      "tier",
      "list",
      "Luthiea",
      "luthiea"
    ]
  },
  "default_description": "Luthiea is a epic attack champion from the faction High Elves doing force damage",
  "recommended_builds": [],
  "lore": ""
}
