{
  "name": "Malbranche",
  "rarity": "Rare",
  "element": "Void",
  "type": "Attack",
  "rating": {
    "overall": "",
    "campaign": "",
    "arena_offense": "",
    "arena_defense": "",
    "clan_boss_without_giant_slayer": "",
    "clan_boss_with_giant_slayer": "",
    "ice_guardian": "",
    "dragon": "",
    "spider": "",
    "fire_knight": "",
    "minotaur": "",
    "force_dungeon": "",
    "magic_dungeon": "",
    "spirit_dungeon": "",
    "void_dungeon": ""
  },
  "slug": "malbranche",
  "characteristics": {
    "60": {
      "hp": 14865,
      "attack": 1321,
      "defense": 716,
      "speed": 111,
      "critical_rate": 0.15,
      "critical_damage": 0.5,
      "resistance": 30,
      "accuracy": 0
    }
  },
  "auras": [],
  "skills": [],
  "faction": {
    "name": "Demonspawn",
    "slug": "demonspawn",
    "website_link": "/factions/demonspawn/",
    "image_slug": "image-faction-demonspawn",
    "number_of_champions": 0,
    "default_description": "Demonspawn is a faction from RAID Shadow Legends",
    "seo": {
      "title": "%%title%% %%page%% %%sep%% %%parent_title%% %%sep%% %%sitename%%",
      "description": "Demonspawn is a faction from RAID Shadow Legends. Find out more on this Raid Shadow Legends codex.",
      "keywords": [
        "raid",
        "shadow",
        "legends",
        "factions",
        "Demonspawn",
        "demonspawn"
      ],
      "structured_data": null
    }
  },
  "faction_slug": "demonspawn",
  "website_link": "/champions/malbranche/",
  "image_slug": "image-champion-malbranche",
  "seo": {
    "title": "%%title%% %%page%% %%sep%% %%parent_title%% %%sep%% %%sitename%%",
    "description": "Malbranche is a rare attack champion from the faction Demonspawn doing void damage. Find out more on this Raid Shadow Legends codex.",
    "keywords": [
      "raid",
      "shadow",
      "legends",
      "champions",
      "tier",
      "list",
      "Malbranche",
      "malbranche"
    ],
    "structured_data": [
      {
        "@context": "http://schema.org/",
        "@type": "Person",
        "affiliation": {
          "@context": "http://schema.org",
          "@type": "Organization",
          "name": "Demonspawn"
        },
        "description": "Member of the faction Demonspawn, Malbranche is a champion of Rare rarity and of Attack type",
        "image": "https://raid-codex.com/wp-content/uploads/champions/image-champion-malbranche.jpg",
        "name": "Malbranche",
        "url": "https://raid-codex.com/champions/malbranche/"
      }
    ]
  },
  "default_description": "Malbranche is a rare attack champion from the faction Demonspawn doing void damage",
  "recommended_builds": [],
  "lore": ""
}
