{
  "name": "Guardian",
  "rarity": "Rare",
  "element": "Spirit",
  "type": "HP",
  "rating": {
    "overall": "B",
    "campaign": "C",
    "arena_offense": "B",
    "arena_defense": "B",
    "clan_boss_without_giant_slayer": "D",
    "clan_boss_with_giant_slayer": "",
    "ice_guardian": "B",
    "dragon": "B",
    "spider": "C",
    "fire_knight": "B",
    "minotaur": "B",
    "force_dungeon": "C",
    "magic_dungeon": "A",
    "spirit_dungeon": "B",
    "void_dungeon": "B"
  },
  "slug": "guardian",
  "characteristics": {
    "60": {
      "hp": 19155,
      "attack": 826,
      "defense": 925,
      "speed": 96,
      "critical_rate": 0.15,
      "critical_damage": 0.5,
      "resistance": 40,
      "accuracy": 0
    }
  },
  "auras": [
    {
      "raw_description": "Increases Ally HP in Dungeons by 27%."
    }
  ],
  "skills": [
    {
      "name": "Chop",
      "raw_description": "Attacks 1 enemy. Has a 50% chance of decreasing the duration of all enemy buffs by 2 turns.<br>Damage based on: [ATK]<br>Lvl. 2 Damage +5%<br>Lvl. 3 Buff/Debuff Chance +5%<br>Lvl. 4 Damage +5%<br>Lvl. 5 Buff/Debuff Chance +5%<br>Lvl. 6 Damage +5%<br>Lvl. 7 Buff/Debuff Chance +5%",
      "slug": "chop"
    },
    {
      "name": "Thunderclap",
      "raw_description": "Attacks 4 times at random. Each hit has a 30% chance of applying a [Block Buffs] debuff for 2 turns.<br>Damage based on: [ATK] [HP]<br>Lvl. 2 Damage +10%<br>Lvl. 3 Damage +10%<br>Lvl. 4 Buff/Debuff Chance +5%<br>Lvl. 5 Damage +10%<br>Lvl. 6 Cooldown -1",
      "slug": "thunderclap"
    },
    {
      "name": "Prayer",
      "raw_description": "Places a [Block Debuffs] buff and a [Counterattack] buff on this Champion for 2 turns. Also places a 15% [Continuous Heal] buff on this Champion for 2 turns.<br>Lvl. 2 Cooldown -1",
      "slug": "prayer"
    }
  ],
  "faction": {
    "name": "Knight Revenant",
    "slug": "knight-revenant",
    "website_link": "/factions/knight-revenant/",
    "image_slug": "image-faction-knight-revenant",
    "number_of_champions": 0,
    "default_description": "Knight Revenant is a faction from RAID Shadow Legends",
    "seo": {
      "title": "%%title%% %%page%% %%sep%% %%parent_title%% %%sep%% %%sitename%%",
      "description": "Knight Revenant is a faction from RAID Shadow Legends. Find out more on this Raid Shadow Legends codex.",
      "keywords": [
        "raid",
        "shadow",
        "legends",
        "factions",
        "Knight Revenant",
        "knight-revenant"
      ]
    }
  },
  "faction_slug": "knight-revenant",
  "website_link": "/champions/guardian/",
  "image_slug": "image-champion-guardian",
  "seo": {
    "title": "%%title%% %%page%% %%sep%% %%parent_title%% %%sep%% %%sitename%%",
    "description": "Guardian is a rare hp champion from the faction Knight Revenant doing spirit damage. Find out more on this Raid Shadow Legends codex.",
    "keywords": [
      "raid",
      "shadow",
      "legends",
      "champions",
      "tier",
      "list",
      "Guardian",
      "guardian"
    ]
  },
  "default_description": "Guardian is a rare hp champion from the faction Knight Revenant doing spirit damage",
  "recommended_builds": [],
  "lore": ""
}