{
  "name": "Big'Un",
  "rarity": "Legendary",
  "element": "Magic",
  "type": "Attack",
  "rating": {
    "overall": "S",
    "campaign": "SS",
    "arena_offense": "SS",
    "arena_defense": "SS",
    "clan_boss_without_giant_slayer": "C",
    "clan_boss_with_giant_slayer": "D",
    "ice_guardian": "SS",
    "dragon": "A",
    "spider": "SS",
    "fire_knight": "C",
    "minotaur": "S",
    "force_dungeon": "B",
    "magic_dungeon": "B",
    "spirit_dungeon": "C",
    "void_dungeon": "B"
  },
  "slug": "big-un",
  "characteristics": {
    "60": {
      "hp": 17505,
      "attack": 1575,
      "defense": 837,
      "speed": 104,
      "critical_rate": 0.15,
      "critical_damage": 0.63,
      "resistance": 30,
      "accuracy": 10
    }
  },
  "auras": [],
  "skills": [],
  "faction": {
    "name": "Ogryn-Tribes",
    "slug": "ogryn-tribes",
    "website_link": "/factions/ogryn-tribes/",
    "image_slug": "image-faction-ogryn-tribes",
    "number_of_champions": 0,
    "default_description": "Ogryn-Tribes is a faction from RAID Shadow Legends",
    "seo": {
      "title": "%%title%% %%page%% %%sep%% %%parent_title%% %%sep%% %%sitename%%",
      "description": "Ogryn-Tribes is a faction from RAID Shadow Legends. Find out more on this Raid Shadow Legends codex.",
      "keywords": [
        "raid",
        "shadow",
        "legends",
        "factions",
        "Ogryn-Tribes",
        "ogryn-tribes"
      ]
    }
  },
  "faction_slug": "ogryn-tribes",
  "website_link": "/champions/big-un/",
  "image_slug": "image-champion-big-un",
  "seo": {
    "title": "%%title%% %%page%% %%sep%% %%parent_title%% %%sep%% %%sitename%%",
    "description": "Big'Un is a legendary attack champion from the faction Ogryn-Tribes doing magic damage. Find out more on this Raid Shadow Legends codex.",
    "keywords": [
      "raid",
      "shadow",
      "legends",
      "champions",
      "tier",
      "list",
      "Big'Un",
      "big-un"
    ]
  },
  "default_description": "Big'Un is a legendary attack champion from the faction Ogryn-Tribes doing magic damage",
  "recommended_builds": [],
  "lore": ""
}
