{
  "name": "Redeemer",
  "rarity": "Uncommon",
  "element": "",
  "type": "Attack",
  "rating": {
    "overall": "D",
    "campaign": "",
    "arena_offense": "",
    "arena_defense": "",
    "clan_boss_without_giant_slayer": "",
    "clan_boss_with_giant_slayer": "",
    "ice_guardian": "",
    "dragon": "",
    "spider": "",
    "fire_knight": "",
    "minotaur": "",
    "force_dungeon": "",
    "magic_dungeon": "",
    "spirit_dungeon": "",
    "void_dungeon": ""
  },
  "slug": "redeemer",
  "characteristics": {
    "60": {
      "hp": 10905,
      "attack": 1024,
      "defense": 727,
      "speed": 92,
      "critical_rate": 0.15,
      "critical_damage": 0.5,
      "resistance": 30,
      "accuracy": 0
    }
  },
  "auras": [],
  "skills": [
    {
      "name": "Split",
      "raw_description": "Attacks 1 enemy. Places a 25% [Increase ATK] buff on this Champion for 1 turn if this attack is critical.<br>Damage based on: [ATK]<br>Lvl. 2 Damage +5%<br>Lvl. 3 Damage +5%<br>Lvl. 4 Damage +5%<br>Lvl. 5 Damage +10%",
      "slug": "split"
    },
    {
      "name": "Elven Blade",
      "raw_description": "Attacks 1 enemy. Has a 50% chance of placing a 2.5% [Poison] debuff for 2 turns.<br>Damage based on: [ATK]<br>Lvl. 2 Damage +5%<br>Lvl. 3 Damage +5%<br>Lvl. 4 Buff/Debuff Chance +10%<br>Lvl. 5 Buff/Debuff Chance +15%<br>Lvl. 6 Cooldown -1",
      "slug": "elven-blade"
    }
  ],
  "faction": {
    "name": "Dark Elves",
    "slug": "dark-elves",
    "website_link": "/factions/dark-elves/",
    "image_slug": "image-faction-dark-elves",
    "number_of_champions": 0,
    "default_description": "Dark Elves is a faction from RAID Shadow Legends",
    "seo": {
      "title": "%%title%% %%page%% %%sep%% %%parent_title%% %%sep%% %%sitename%%",
      "description": "Dark Elves is a faction from RAID Shadow Legends. Find out more on this Raid Shadow Legends codex.",
      "keywords": [
        "raid",
        "shadow",
        "legends",
        "factions",
        "Dark Elves",
        "dark-elves"
      ]
    }
  },
  "faction_slug": "dark-elves",
  "website_link": "/champions/redeemer/",
  "image_slug": "image-champion-redeemer",
  "seo": {
    "title": "%%title%% %%page%% %%sep%% %%parent_title%% %%sep%% %%sitename%%",
    "description": "Redeemer is a uncommon attack champion from the faction Dark Elves. Find out more on this Raid Shadow Legends codex.",
    "keywords": [
      "raid",
      "shadow",
      "legends",
      "champions",
      "tier",
      "list",
      "Redeemer",
      "redeemer"
    ]
  },
  "default_description": "Redeemer is a uncommon attack champion from the faction Dark Elves",
  "recommended_builds": [],
  "lore": ""
}
