{
  "name": "Vrask",
  "rarity": "Epic",
  "element": "Spirit",
  "type": "HP",
  "rating": {
    "overall": "S",
    "campaign": "S",
    "arena_offense": "A",
    "arena_defense": "A",
    "clan_boss_without_giant_slayer": "S",
    "clan_boss_with_giant_slayer": "S",
    "ice_guardian": "S",
    "dragon": "S",
    "spider": "S",
    "fire_knight": "A",
    "minotaur": "S",
    "force_dungeon": "S",
    "magic_dungeon": "S",
    "spirit_dungeon": "S",
    "void_dungeon": "S"
  },
  "slug": "vrask",
  "characteristics": {
    "60": {
      "hp": 23460,
      "attack": 870,
      "defense": 870,
      "speed": 97,
      "critical_rate": 0.15,
      "critical_damage": 0.5,
      "resistance": 45,
      "accuracy": 0
    }
  },
  "auras": [
    {
      "raw_description": "Increases Ally DEF in Dungeons by 33%."
    }
  ],
  "skills": [
    {
      "name": "Whack",
      "raw_description": "Attacks 1 enemy. Fills this Champion's Turn Meter by 20% if this attack is critical.<br>Damage based on: [HP]<br>Lvl. 2 Damage +5%<br>Lvl. 3 Damage +5%<br>Lvl. 4 Damage +5%<br>Lvl. 5 Damage +5%",
      "slug": "whack"
    },
    {
      "name": "Lightning Strike",
      "raw_description": "Attacks 1 enemy.<br>Damage based on: [HP]<br>Lvl. 2 Damage +5%<br>Lvl. 3 Damage +10%<br>Lvl. 4 Damage +10%<br>Lvl. 5 Cooldown -1",
      "slug": "lightning-strike"
    },
    {
      "name": "Cannibalism",
      "raw_description": "Heals all allies by 10% of his MAX HP when he inflicts a critical hit.",
      "slug": "cannibalism"
    }
  ],
  "faction": {
    "name": "Orcs",
    "slug": "orcs",
    "website_link": "/factions/orcs/",
    "image_slug": "image-faction-orcs",
    "number_of_champions": 0,
    "default_description": "Orcs is a faction from RAID Shadow Legends",
    "seo": {
      "title": "%%title%% %%page%% %%sep%% %%parent_title%% %%sep%% %%sitename%%",
      "description": "Orcs is a faction from RAID Shadow Legends. Find out more on this Raid Shadow Legends codex.",
      "keywords": [
        "raid",
        "shadow",
        "legends",
        "factions",
        "Orcs",
        "orcs"
      ]
    }
  },
  "faction_slug": "orcs",
  "website_link": "/champions/vrask/",
  "image_slug": "image-champion-vrask",
  "seo": {
    "title": "%%title%% %%page%% %%sep%% %%parent_title%% %%sep%% %%sitename%%",
    "description": "Vrask is a epic hp champion from the faction Orcs doing spirit damage. Find out more on this Raid Shadow Legends codex.",
    "keywords": [
      "raid",
      "shadow",
      "legends",
      "champions",
      "tier",
      "list",
      "Vrask",
      "vrask"
    ]
  },
  "default_description": "Vrask is a epic hp champion from the faction Orcs doing spirit damage",
  "recommended_builds": [],
  "lore": ""
}
