{
  "name": "Graybeard",
  "rarity": "Rare",
  "element": "Magic",
  "type": "Def",
  "rating": {
    "overall": "B",
    "campaign": "B",
    "arena_offense": "B",
    "arena_defense": "B",
    "clan_boss_without_giant_slayer": "D",
    "clan_boss_with_giant_slayer": "D",
    "ice_guardian": "B",
    "dragon": "B",
    "spider": "B",
    "fire_knight": "D",
    "minotaur": "B",
    "force_dungeon": "C",
    "magic_dungeon": "C",
    "spirit_dungeon": "C",
    "void_dungeon": "B"
  },
  "slug": "graybeard",
  "characteristics": {
    "60": {
      "hp": 15525,
      "attack": 1024,
      "defense": 1112,
      "speed": 92,
      "critical_rate": 0.15,
      "critical_damage": 0.5,
      "resistance": 40,
      "accuracy": 0
    }
  },
  "auras": [
    {
      "raw_description": "Increases Ally DEF in Dungeons by 30%."
    }
  ],
  "skills": [
    {
      "name": "Expose Weakness",
      "raw_description": "Attacks 1 enemy. Has a 50% chance of placing a [Provoke] debuff for 1 turn.<br>Damage based on: [ATK]<br>Lvl. 2 Damage +5%<br>Lvl. 3 Buff/Debuff Chance +5%<br>Lvl. 4 Damage +10%<br>Lvl. 5 Buff/Debuff Chance +5%<br>Lvl. 6 Buff/Debuff Chance +10%",
      "slug": "expose-weakness"
    },
    {
      "name": "Ice Crush",
      "raw_description": "Attacks all enemies. Has a 25% chance of placing a [Freeze] debuff for 1 turn. Damage inflicted is proportional to DEF.<br>Damage based on: [DEF]<br>Lvl. 2 Damage +5%<br>Lvl. 3 Buff/Debuff Chance +5%<br>Lvl. 4 Damage +10%<br>Lvl. 5 Cooldown -1<br>Lvl. 6 Buff/Debuff Chance +10%<br>Lvl. 7 Cooldown -1",
      "slug": "ice-crush"
    },
    {
      "name": "Bring It On",
      "raw_description": "Places a [Shield] buff on this Champion for 2 turns. Has an 80% chance of placing a [Counterattack] buff on this Champion for 2 turns. removed.<br>Lvl. 2 Buff/Debuff Chance +10%<br>Lvl. 3 Buff/Debuff Chance +10%<br>Lvl. 4 Cooldown -1<br>Lvl. 5 Cooldown -1",
      "slug": "bring-it-on"
    }
  ],
  "faction": {
    "name": "Skinwalker",
    "slug": "skinwalker",
    "website_link": "/factions/skinwalker/",
    "image_slug": "image-faction-skinwalker",
    "number_of_champions": 0,
    "default_description": "Skinwalker is a faction from RAID Shadow Legends",
    "seo": {
      "title": "%%title%% %%page%% %%sep%% %%parent_title%% %%sep%% %%sitename%%",
      "description": "Skinwalker is a faction from RAID Shadow Legends. Find out more on this Raid Shadow Legends codex.",
      "keywords": [
        "raid",
        "shadow",
        "legends",
        "factions",
        "Skinwalker",
        "skinwalker"
      ]
    }
  },
  "faction_slug": "skinwalker",
  "website_link": "/champions/graybeard/",
  "image_slug": "image-champion-graybeard",
  "seo": {
    "title": "%%title%% %%page%% %%sep%% %%parent_title%% %%sep%% %%sitename%%",
    "description": "Graybeard is a rare def champion from the faction Skinwalker doing magic damage. Find out more on this Raid Shadow Legends codex.",
    "keywords": [
      "raid",
      "shadow",
      "legends",
      "champions",
      "tier",
      "list",
      "Graybeard",
      "graybeard"
    ]
  },
  "default_description": "Graybeard is a rare def champion from the faction Skinwalker doing magic damage",
  "recommended_builds": [],
  "lore": ""
}