{
  "name": "Commander",
  "rarity": "Uncommon",
  "element": "",
  "type": "Assist",
  "rating": {
    "overall": "D",
    "campaign": "",
    "arena_offense": "",
    "arena_defense": "",
    "clan_boss_without_giant_slayer": "",
    "clan_boss_with_giant_slayer": "",
    "ice_guardian": "",
    "dragon": "",
    "spider": "",
    "fire_knight": "",
    "minotaur": "",
    "force_dungeon": "",
    "magic_dungeon": "",
    "spirit_dungeon": "",
    "void_dungeon": ""
  },
  "slug": "commander",
  "characteristics": {
    "60": {
      "hp": 15690,
      "attack": 936,
      "defense": 771,
      "speed": 101,
      "critical_rate": 0.15,
      "critical_damage": 0.5,
      "resistance": 30,
      "accuracy": 0
    }
  },
  "auras": [],
  "skills": [
    {
      "name": "Holy Fire",
      "raw_description": "Attacks 1 enemy. Has a 15% chance of placing a [Stun] debuff for 1 turn.<br>Damage based on: [ATK]<br>Lvl. 2 Damage +5%<br>Lvl. 3 Damage +5%<br>Lvl. 4 Damage +10%<br>Lvl. 5 Buff/Debuff Chance +5%<br>Lvl. 6 Damage +10%<br>Lvl. 7 Damage +10%<br>Lvl. 8 Buff/Debuff Chance +5%",
      "slug": "holy-fire"
    },
    {
      "name": "Quickheal",
      "raw_description": "Heals the ally with the lowest HP by 40% of this Champion's HP. Completely fills the target's Turn Meter if the ally is fully healed. This Champion's Turn Meter cannot be filled by this Skill.<br>Lvl. 2 Heal +5%<br>Lvl. 3 Heal +5%<br>Lvl. 4 Heal +5%<br>Lvl. 5 Heal +10%<br>Lvl. 6 Cooldown -1<br>Lvl. 7 Cooldown -1",
      "slug": "quickheal"
    }
  ],
  "faction": {
    "name": "Banner-Lords",
    "slug": "banner-lords",
    "website_link": "/factions/banner-lords/",
    "image_slug": "image-faction-banner-lords",
    "number_of_champions": 0,
    "default_description": "Banner Lords is a faction from RAID Shadow Legends",
    "seo": {
      "title": "%%title%% %%page%% %%sep%% %%parent_title%% %%sep%% %%sitename%%",
      "description": "Banner Lords is a faction from RAID Shadow Legends. Find out more on this Raid Shadow Legends codex.",
      "keywords": [
        "raid",
        "shadow",
        "legends",
        "factions",
        "Banner Lords",
        "banner-lords"
      ]
    }
  },
  "faction_slug": "banner-lords",
  "website_link": "/champions/commander/",
  "image_slug": "image-champion-commander",
  "seo": {
    "title": "%%title%% %%page%% %%sep%% %%parent_title%% %%sep%% %%sitename%%",
    "description": "Commander is a uncommon support champion from the faction Banner Lords. Find out more on this Raid Shadow Legends codex.",
    "keywords": [
      "raid",
      "shadow",
      "legends",
      "champions",
      "tier",
      "list",
      "Commander",
      "commander"
    ]
  },
  "default_description": "Commander is a uncommon support champion from the faction Banner Lords",
  "recommended_builds": [],
  "lore": ""
}
