{
  "name": "Executioner",
  "rarity": "Rare",
  "element": "Magic",
  "type": "Def",
  "rating": {
    "overall": "A",
    "campaign": "S",
    "arena_offense": "A",
    "arena_defense": "A",
    "clan_boss_without_giant_slayer": "C",
    "clan_boss_with_giant_slayer": "",
    "ice_guardian": "A",
    "dragon": "B",
    "spider": "B",
    "fire_knight": "D",
    "minotaur": "B",
    "force_dungeon": "C",
    "magic_dungeon": "C",
    "spirit_dungeon": "B",
    "void_dungeon": "B"
  },
  "slug": "executioner",
  "characteristics": {
    "60": {
      "hp": 14865,
      "attack": 782,
      "defense": 1255,
      "speed": 89,
      "critical_rate": 0.15,
      "critical_damage": 0.5,
      "resistance": 40,
      "accuracy": 0
    }
  },
  "auras": [
    {
      "raw_description": "Increases Ally DEF in all Battles by 17%."
    }
  ],
  "skills": [
    {
      "name": "Shield Bash",
      "raw_description": "Attacks 1 enemy. Has a 15% chance of placing a [Stun] debuff for 1 turn.<br>Damage based on: [ATK]<br>Lvl. 2 Damage +10%<br>Lvl. 3 Buff/Debuff Chance +5%<br>Lvl. 4 Damage +10%<br>Lvl. 5 Buff/Debuff Chance +5%<br>Lvl. 6 Buff/Debuff Chance +5%",
      "slug": "shield-bash"
    },
    {
      "name": "Tumult",
      "raw_description": "Attacks all enemies. Decreases the Turn Meter by 20%. Has a 50% chance of placing a 15% [Decrease SPD] debuff for 2 turns.<br>Damage based on: [ATK] [DEF]<br>Lvl. 2 Damage +5%<br>Lvl. 3 Buff/Debuff Chance +10%<br>Lvl. 4 Damage +10%<br>Lvl. 5 Buff/Debuff Chance +15%<br>Lvl. 6 Cooldown -1",
      "slug": "tumult"
    },
    {
      "name": "Schiltron",
      "raw_description": "Places a 60% [Increase DEF] buff and a [Counterattack] buff on this Champion for 3 turns.<br>Lvl. 2 Cooldown -1<br>Lvl. 3 Cooldown -1",
      "slug": "schiltron"
    }
  ],
  "faction": {
    "name": "Knight Revenant",
    "slug": "knight-revenant",
    "website_link": "/factions/knight-revenant/",
    "image_slug": "image-faction-knight-revenant",
    "number_of_champions": 0,
    "default_description": "Knight Revenant is a faction from RAID Shadow Legends",
    "seo": {
      "title": "%%title%% %%page%% %%sep%% %%parent_title%% %%sep%% %%sitename%%",
      "description": "Knight Revenant is a faction from RAID Shadow Legends. Find out more on this Raid Shadow Legends codex.",
      "keywords": [
        "raid",
        "shadow",
        "legends",
        "factions",
        "Knight Revenant",
        "knight-revenant"
      ]
    }
  },
  "faction_slug": "knight-revenant",
  "website_link": "/champions/executioner/",
  "image_slug": "image-champion-executioner",
  "seo": {
    "title": "%%title%% %%page%% %%sep%% %%parent_title%% %%sep%% %%sitename%%",
    "description": "Executioner is a rare def champion from the faction Knight Revenant doing magic damage. Find out more on this Raid Shadow Legends codex.",
    "keywords": [
      "raid",
      "shadow",
      "legends",
      "champions",
      "tier",
      "list",
      "Executioner",
      "executioner"
    ]
  },
  "default_description": "Executioner is a rare def champion from the faction Knight Revenant doing magic damage",
  "recommended_builds": [],
  "lore": ""
}