{
  "name": "Ghostborn",
  "rarity": "Legendary",
  "element": "Spirit",
  "type": "Assist",
  "rating": {
    "overall": "S",
    "campaign": "A",
    "arena_offense": "S",
    "arena_defense": "A",
    "clan_boss_without_giant_slayer": "B",
    "clan_boss_with_giant_slayer": "",
    "ice_guardian": "S",
    "dragon": "A",
    "spider": "SS",
    "fire_knight": "S",
    "minotaur": "A",
    "force_dungeon": "SS",
    "magic_dungeon": "B",
    "spirit_dungeon": "S",
    "void_dungeon": "B"
  },
  "slug": "ghostborn",
  "characteristics": {
    "60": {
      "hp": 18825,
      "attack": 1211,
      "defense": 1112,
      "speed": 101,
      "critical_rate": 0.15,
      "critical_damage": 0.5,
      "resistance": 40,
      "accuracy": 0
    }
  },
  "auras": [],
  "skills": [
    {
      "name": "Energy Bolt",
      "raw_description": "Attacks 1 enemy. Has a 50% chance of placing a 60% [Decrease DEF] debuff for 2 turns.<br>Damage based on: [ATK]<br>Lvl. 2 Buff/Debuff Chance +10%<br>Lvl. 3 Buff/Debuff Chance +10%<br>Lvl. 4 Buff/Debuff Chance +10%<br>Lvl. 5 Buff/Debuff Chance +20%",
      "slug": "energy-bolt"
    },
    {
      "name": "Petrify",
      "raw_description": "Attacks all enemies. Has a 75% chance of placing a 100% [Heal Reduction] debuff for 2 turns.<br>Damage based on: [ATK] [SPD]<br>Lvl. 2 Buff/Debuff Chance +10%<br>Lvl. 3 Buff/Debuff Chance +15%<br>Lvl. 4 Cooldown -1",
      "slug": "petrify"
    },
    {
      "name": "Ancestral Spirits",
      "raw_description": "Attacks all enemies. Has a 75% chance of placing a 60% [Decrease DEF] debuff for 2 turns. This debuff cannot be resisted. Places a 50% [Increase ATK] buff on all allies for 2 turns.<br>Damage based on: [ATK]<br>Lvl. 2 Buff/Debuff Chance +10%<br>Lvl. 3 Buff/Debuff Chance +15%<br>Lvl. 4 Cooldown -1",
      "slug": "ancestral-spirits"
    }
  ],
  "faction": {
    "name": "Dark Elves",
    "slug": "dark-elves",
    "website_link": "/factions/dark-elves/",
    "image_slug": "image-faction-dark-elves",
    "number_of_champions": 0,
    "default_description": "Dark Elves is a faction from RAID Shadow Legends",
    "seo": {
      "title": "%%title%% %%page%% %%sep%% %%parent_title%% %%sep%% %%sitename%%",
      "description": "Dark Elves is a faction from RAID Shadow Legends. Find out more on this Raid Shadow Legends codex.",
      "keywords": [
        "raid",
        "shadow",
        "legends",
        "factions",
        "Dark Elves",
        "dark-elves"
      ]
    }
  },
  "faction_slug": "dark-elves",
  "website_link": "/champions/ghostborn/",
  "image_slug": "image-champion-ghostborn",
  "seo": {
    "title": "%%title%% %%page%% %%sep%% %%parent_title%% %%sep%% %%sitename%%",
    "description": "Ghostborn is a legendary assist champion from the faction Dark Elves doing spirit damage. Find out more on this Raid Shadow Legends codex.",
    "keywords": [
      "raid",
      "shadow",
      "legends",
      "champions",
      "tier",
      "list",
      "Ghostborn",
      "ghostborn"
    ]
  },
  "default_description": "Ghostborn is a legendary assist champion from the faction Dark Elves doing spirit damage",
  "recommended_builds": [],
  "lore": ""
}