{
  "name": "Paragon",
  "rarity": "Rare",
  "element": "Void",
  "type": "Def",
  "rating": {
    "overall": "A",
    "campaign": "C",
    "arena_offense": "A",
    "arena_defense": "A",
    "clan_boss_without_giant_slayer": "B",
    "clan_boss_with_giant_slayer": "",
    "ice_guardian": "B",
    "dragon": "B",
    "spider": "C",
    "fire_knight": "S",
    "minotaur": "B",
    "force_dungeon": "C",
    "magic_dungeon": "C",
    "spirit_dungeon": "S",
    "void_dungeon": "B"
  },
  "slug": "paragon",
  "characteristics": {
    "60": {
      "hp": 14370,
      "attack": 958,
      "defense": 1112,
      "speed": 96,
      "critical_rate": 0.15,
      "critical_damage": 0.5,
      "resistance": 30,
      "accuracy": 0
    }
  },
  "auras": [],
  "skills": [
    {
      "name": "Power Drain",
      "raw_description": "Attacks 1 enemy. Has a 50% chance of decreasing the target's Turn Meter by 10%. Damage inflicted is proportional to DEF.<br>Damage based on: [DEF]<br>Lvl. 2 Damage +5%<br>Lvl. 3 Damage +5%<br>Lvl. 4 Damage +5%<br>Lvl. 5 Damage +5%",
      "slug": "power-drain"
    },
    {
      "name": "Damage Control",
      "raw_description": "Places an [Unkillable] buff and a 25% [Increase ATK] buff on a target ally for 2 turns.<br>Lvl. 2 Cooldown -1<br>Lvl. 3 Cooldown -1",
      "slug": "damage-control"
    },
    {
      "name": "Life Shackles",
      "raw_description": "Attacks 3 times at random. Each hit has a 30% chance of placing a 100% [Heal Reduction] debuff and a 50% [Decrease ATK] debuff for 2 turns. Damage inflicted is proportional to DEF.<br>Damage based on: [DEF]<br>Lvl. 2 Buff/Debuff Chance +5%<br>Lvl. 3 Buff/Debuff Chance +5%<br>Lvl. 4 Buff/Debuff Chance +10%<br>Lvl. 5 Cooldown -1",
      "slug": "life-shackles"
    }
  ],
  "faction": {
    "name": "Dark Elves",
    "slug": "dark-elves",
    "website_link": "/factions/dark-elves/",
    "image_slug": "image-faction-dark-elves",
    "number_of_champions": 0,
    "default_description": "Dark Elves is a faction from RAID Shadow Legends",
    "seo": {
      "title": "%%title%% %%page%% %%sep%% %%parent_title%% %%sep%% %%sitename%%",
      "description": "Dark Elves is a faction from RAID Shadow Legends. Find out more on this Raid Shadow Legends codex.",
      "keywords": [
        "raid",
        "shadow",
        "legends",
        "factions",
        "Dark Elves",
        "dark-elves"
      ]
    }
  },
  "faction_slug": "dark-elves",
  "website_link": "/champions/paragon/",
  "image_slug": "image-champion-paragon",
  "seo": {
    "title": "%%title%% %%page%% %%sep%% %%parent_title%% %%sep%% %%sitename%%",
    "description": "Paragon is a rare def champion from the faction Dark Elves doing void damage. Find out more on this Raid Shadow Legends codex.",
    "keywords": [
      "raid",
      "shadow",
      "legends",
      "champions",
      "tier",
      "list",
      "Paragon",
      "paragon"
    ]
  },
  "default_description": "Paragon is a rare def champion from the faction Dark Elves doing void damage",
  "recommended_builds": [],
  "lore": ""
}